Food,Calories
Leafy No-Lettuce Salad ,224.0
Steak with Mustard and Green Peppercorns ,604.0
Carrot Cupcakes with Ginger-Cream Cheese Icing ,246.0
Cranberry Apricot Pecan Strudel ,362.0
Lemon-Ginger Cake with Pistachios ,1093.0
Cream of Broccoli Soup with Wild Mushrooms ,533.0
"Blue Cheese, Apple, and Sage-Honey Crostini ",
Best-Ever Barbecued Ribs ,1115.0
Whole Wheat Bread with Raisins and Walnuts ,267.0
Mussels in Carrot Ginger Broth ,19.0
Celery and Jícama Sauté ,82.0
Opera ,141.0
Mustard Tarragon Butter ,210.0
Rice Pudding with Dried Cherries and Vanilla ,231.0
Pan Fried Potatoes with Paprika and Lemon ,307.0
Supper Clam Chowder ,592.0
Cranberry-Vodka Punch ,267.0
Pomegranate-Glazed Eggplant ,
Sweet Tea ,97.0
Buttermilk Doughnuts ,383.0
Soy-Glazed Beef Burger ,454.0
Asian Dipping Sauce ,107.0
Grilled Steak and Onions with Rosemary-Balsamic Butter Sauce ,906.0
"Fillet of Beef, Arugula, and Artichoke Crostini ",
Potato Salad with Grilled Kale ,331.0
Mushroom Croque-Monsieur ,771.0
Panfried Flank Steak with Mushroom Ragoût ,409.0
Spiced Tuna Steaks with Fennel and Red Peppers ,390.0
Espresso Whipped Cream ,235.0
Strawberry Margarita Ice Pops ,104.0
Chive-Corn Muffins ,224.0
Grilled Tandoori Lamb ,
"5-Grain Porridge with Bee Pollen, Apples, and Coconut ",391.0
Kaffir Lime Mousse with Honeydew Water ,299.0
Cowboy Flatbread Topped with Arugula Salad and Lemon-Pepper Dressing ,544.0
Spiced Hot Chocolate ,224.0
Candied Sweet-Potato Purée ,338.0
Corn and Avocado Relish ,180.0
Sour Cream Biscuits With Sausage Gravy ,
Smoked Black Bass ,
Grapefruit Gimlet ,192.0
Walnut Mini-Loaves ,549.0
Parboiled Rice ,234.0
Greek Yogurt Ice Cream ,191.0
Barbecue Boneless Pork Ribs ,
Butter Baste ,
Ginger Vinaigrette ,554.0
Smoked Salmon and Herbed Yogurt Roulade ,
Indian-Spiced Shrimp ,180.0
Mutabal ,205.0
Prosciutto-Roasted Halibut with Fresh Thyme ,258.0
Vanilla Bean Ice Cream ,
Vanilla Panna Cotta with Mixed-Berry Compote ,333.0
Korean-Style Tuna Tartare ,213.0
Portobello Mushroom Burgers with Basil-Mustard Sauce ,406.0
"Bibb Lettuce with Shrimp, Asparagus, and Chive Aïoli ",
"Savoy Cabbage, Carrot, and Apple Salad ",
Balsamic and Tomato Roast Chicken ,493.0
Seafood en Brodo with Tarragon Pesto ,
Golden and Long Beet Salad with Roquefort ,223.0
Linguine and Zucchini with Bagna Cauda Sauce ,506.0
Mexican Pineapple Salad ,343.0
Chinese Trinidadian Stir-Fried Shrimp with Rum ,344.0
Toasted Hazelnut Salad with Dried Cranberries and Hazelnut Vinaigrette ,196.0
Oatmeal Lace Cookies ,91.0
Raspberry Coulis ,123.0
German-Style Potato and Ham Salad ,410.0
Shrimp and Watermelon Salad ,
Risotto Primavera ,529.0
Herbed Polenta Triangles ,197.0
Sweet-Potato Coconut Purée ,361.0
Brown Sugar and Coffee Barbecue Sauce ,158.0
Whole Wheat Pancakes with Bananas and Pecans ,141.0
Skewered Scallops with Orange-Sesame Dipping Sauce ,185.0
Rib-Eye Steaks with Curried Salt ,891.0
"Artichoke, Fresh Mozzarella, and Salami Sandwiches ",628.0
Fried Neopolitan Pizzas ,826.0
Kir Royale ,
Rice Pudding with Chai Spices ,
Vanilla Snack Cakes ,141.0
Adobo-Rubbed Pork Tenderloin with Black Bean Pico de Gallo ,
Skillet Chicken Pot Pie With Butternut Squash ,
"Roast Vermont Turkey with Giblet Gravy and Sausage and Sage Dressing, for Thanksgiving ",2420.0
Smoked Duck and Walnuts with Winter Greens ,152.0
"Corn Bread with Basil, Roasted Red Peppers and Monterey Jack Cheese ",326.0
Cranberry Tangerine Conserve ,209.0
Ladyfinger ,149.0
Spiced Roast Goose with Dried-Fruit Pan Sauce ,2816.0
Aztec Sluggers ,394.0
Bing Cherry and Raspberry Sauce ,110.0
Irene's Beer Stew ,460.0
Caramel Cheesecake Bites ,
"Cucumber, Radish, and Tomato Salad with Citrus Dressing ",126.0
Green Garlic and Leek Matzo Brei With Smoked Salmon and Horseradish Cream ,279.0
Summer Strawberry Jam ,315.0
Miniature Crab Cakes with Mustard Mayonnaise ,44.0
Butter Braised Oysters on Greens ,355.0
Roasted Butternut Squash Soup ,192.0
Chocolate Mascarpone Mousse with Bananas ,259.0
"Fettuccine with Walnuts, Zucchini Ribbons, and Pecorino Romano ",428.0
Winter Dried Fruit and Nut Chocolate Bark ,
Mint Julep Spritzer ,145.0
Cucumber and Radish Salad ,
Vanilla Cream ,154.0
Pumpkin Seed Pesto ,442.0
Apricot Pear Cordials ,441.0
Maple Crème Caramel ,505.0
Radish and Chive Salad ,21.0
Vegetables Glazed with Balsamic Vinegar ,128.0
Chicken Laap ,272.0
Grilled Chicken and Vegetable Sandwiches with Tarragon Mayonnaise ,500.0
Grilled Vegetable Salad with Tofu ,
Mesa Barbecue Sauce ,222.0
"Spaghetti with Pepperoni, Peas, and Browned Onions ",786.0
Turtle Bars ,284.0
Pasta with Butternut Squash and Spinach ,583.0
Pastry Dough ,287.0
Goose Stew with Barley and Celery Root ,8858.0
Grilled Pork Chops with Anise-Seed Rub and Mango Mojo ,497.0
Curried Sweet Potato Soup ,
Spicy Pickled Green Beans and Fennel ,62.0
Celery Root Soup ,156.0
Peanut Butter Cheesecake with Peanut Brittle ,320.0
Our Favorite Pie Dough ,235.0
Seared Shrimp with Warm New Potato Salad ,
Blueberry Lemon Crumbles ,165.0
Chocolate-Chicory Sauce ,260.0
Marscarpone Cream ,234.0
"Crispy Za'atar Fish with Israeli Couscous, Swiss Chard, and Feta ",280.0
Anchovies in Tomato Sauce with Pasta ,1084.0
Kaffir Lime Mousse with Honeydew Water ,299.0
Pesto ,751.0
Fresh Tomato and Onion Chutney ,68.0
Cider-Brined Pork Roast with Potatoes and Onions ,886.0
Chile Glaze ,172.0
Coconut Milk Whipped Cream ,141.0
Honey-Cardamom Custards with Strawberry-Orange Compote ,300.0
Blueberry Lemon Corn Muffins ,853.0
Black Bean Ancho Chili ,678.0
Baked Hawaiian Islands ,966.0
"Louisiana Mussel ""Sauce Piquante"" with Garlic Bread ",
Spice Cupcakes with Cream-Cheese Icing ,201.0
Herbed-Cheese and Zucchini Omelet ,507.0
Hawaiian ,
Shaved Asparagus with Parmesan Vinaigrette ,431.0
Turkey Gravy ,504.0
Carrot and Radish Salad ,75.0
Chicken and Mashed Potatoes with Herb-Roasted Tomatoes and Olive Broth ,551.0
Grilled Portobello Burgers with Piquillo Pepper Aïoli and Watercress ,505.0
Peppercorn Steaks with Bourbon Sauce ,683.0
Pork Kebabs al Pastor ,641.0
Croutes au Fromage ,255.0
"Tomato, Red Onion, and Basil Bruschetta ",443.0
Vegetable Stock ,11.0
Apple and Celery Salad with Peanuts ,139.0
Tart Shell ,1908.0
Black Olive Aïoli ,338.0
"Pumpkin Pie ""pumpkin"" ",
Herb and Bacon Corn-Bread Stuffing ,
Corn Bread ,284.0
Turkey Giblet Stock ,119.0
Herbed Lima Bean Hummus ,169.0
Cornmeal Harvest Loaves ,279.0
"Potato and Roasted Garlic Soup with Wheat Berry, Watercress, and Endive Salad ",443.0
Beef and Shrimp Kebabs ,
Grilled Chicken with Peach and Apple Salsa ,
"Root Vegetable ""Lasagna"" with Mushroom Broth ",
Apple Cider Vinaigrette ,
Lamb Chops with Cherry Balsamic Sauce and Mint ,1031.0
Veal Demi-Glacé ,
Roasted Red Curry Chicken with Apple Jus ,2073.0
"Sauteed Turbot with Braised Endive, Celery Root Flan, Black Truffles, and Garlic Nage ",646.0
Celery Root Bisque with Thyme Croutons ,215.0
Sweet-Potato Salad with Mustard Viniagrette ,247.0
Cream Puffs with Vanilla Ice Cream and Chocolate Sauce ,1437.0
Grapefruit Tart ,225.0
Strawberry Coconut Pineapple Shake ,196.0
Chicken with Coconut Curry Sauce ,246.0
Vegetable and Chicken Curry ,
Spicy Dill Pickles ,180.0
Tangy Avocado-Orange Salad ,111.0
Cumin-Crusted Monster Pork Chop with Peach Chipotle Salsa ,411.0
Umeboshi and Rice Salad with Pickled Ginger and Sugar Snap Peas ,
Confit Cherry Tomatoes ,13.0
Broiled Salmon with Apple-Date Chutney ,638.0
Layered Chicken Enchiladas with Tomatillo-Cilantro Sauce ,502.0
Chocolate Sauce ,496.0
"Persian New Year's Soup with Beans, Noodles, and Herbs (Ash-e-reshteh) ",
Chocolate Hazelnut Pound Cake with Chocolate Glaze ,
Vanilla Cream ,124.0
Fresh Tomato Salsa ,
Grilled Mango ,102.0
Rhubarb and Ricotta Cheese Puff-Pastry Tartlets ,708.0
"Potato Latkes with Smoked Salmon, Caviar, and Tarragon Crème Fraîche ",117.0
Mexican Clam Dip ,
Herbed Cream Cheese Cucumber Rounds ,13.0
Curried Spinach Soup with Yogurt and Cilantro ,
Rosemary Lamb Chops with Breadcrumbs ,2100.0
Crab Cakes with Green Onion and Dill ,308.0
Rice with Julienned Carrots ,430.0
Turkey Giblet Stock ,116.0
Salmon Platter with Caper Dressing ,617.0
Drunken Raspberries ,241.0
Quick Paella ,500.0
Roast Chicken with Rosemary-Orange Butter ,3413.0
Honeyed Walnut Tart ,419.0
Parmesan Sauce ,138.0
Parmesan Polenta Squares ,77.0
Snapper with Tapenade and Radish and Chive Salad ,767.0
Choucroute with Caramelized Pears ,720.0
Bake-Salé Lemon Meringue Pie ,464.0
Udon Noodle Salad with Grilled Chicken and Coriander Dressing ,
Zeppole ,
Potato and Portobello Mushroom Gratin ,295.0
Eggs with Pickled Shallot and Parsley ,79.0
Beurre Blanc ,99.0
Red-Wine Braised Rabbit with Sage Polenta ,806.0
Lebanese Lamb and Bean Stew ,1291.0
Corn Bread Panzanella ,605.0
"Red Snapper with Cilantro, Garlic, and Lime ",162.0
Herbed Goat Cheese Tart ,347.0
Royal Blueberry Ice Pops ,83.0
Rustic Green Pepper and Olive Pan Pizza ,1588.0
Sloe Gin Spritz ,181.0
Spring Pea And Pea Shoot Omelet ,
Spaghetti with Green Chili-Pine Nut Meatballs ,295.0
Seared Foie Gras and Lingonberry Jam on Brioche Toast ,185.0
Traditional Napa Cabbage Kimchi ,16.0
Yogurt Panna Cotta with Cherry and Peach Compote ,
Italian Vegetable Stew (Ciambotta) ,
Pacific Salmon with Roasted Garlic ,229.0
Butternut Squash Soup with Star Anise and Ginger Shrimp ,1108.0
"Watermelon, Green Onion, and Mint Salad ",127.0
Tostadas with Creamy Roasted Poblanos and Corn ,
Pumpkin Pie with Brown Sugar-Walnut Topping ,
Orange Blossom Cheesecake with Raspberry and Pomegranate Sauce ,945.0
Sesame Beef and Snow Pea Soup ,417.0
Tuna Kebabs with Ginger-Chile Marinade ,435.0
Apple and Blackberry Pie ,597.0
Caramelized Upside-Down Pear Tart ,
Spicy Crab Spaghettini with Preserved Lemon ,447.0
Rum Punch with Passion Fruit and Lime ,703.0
Danish Pastry Braid ,332.0
Classic Spinach-Artichoke Dip with Mozzarella and Parmesan ,269.0
"Raspberry, Rhubarb and Pear Pies ",3561.0
Buttermilk Pie Crust Dough ,259.0
"""Opulent"" Chicken ",660.0
"Shrimp, Vegetable and Cashew Stir-Fry ",618.0
Parmesan Pepper Curly Kale Chips ,
"Creamy Phyllo, Raisin and Nut Pudding ",
Cabbage and Tomato Slaw with Sherry-Mustard Viniagrette ,234.0
Maple Apple Pandowdy with Dried Cranberries ,203.0
Grilled Striped Bass with Lemon and Fennel ,
Zucchini Pancakes with Basil Chive Cream ,88.0
Gumbo Z'herbes with Perfect Rice ,733.0
Pears Poached in Earl Grey Tea with Dried Fruit ,
Farfalle with Tomatoes and Feta Cheese ,364.0
Asian-Style Crab and Shrimp Cakes ,715.0
Purple Potatoes with Sour Cream and Caviar ,104.0
Chestnut Risotto with Butternut Squash ,432.0
Yam and Black Bean Burritos with Amaranth ,494.0
Berry Toast Cups ,376.0
Pastry Dough ,
Mahón Cheese Ice Cream ,235.0
"Puff Pastry Turnovers with Shrimp, Scallops and Spinach ",477.0
Glazed Blueberry-Blackberry Turnovers ,218.0
Louisiana Jambalaya ,519.0
Cauliflower Risotto with Brie and Almonds ,554.0
"Jasmine Rice with Garlic, Ginger, and Cilantro ",328.0
Ginger Garlic Green Beans ,79.0
"Shaved Fennel, Radish, and Grapefruit Salad ",355.0
Cilantro Garlic Yogurt Sauce ,101.0
Miso-Glazed Black Cod on Sunflower Sprouts ,228.0
Mustard and Dill Vinaigrette ,168.0
Fish Stock ,50.0
"Prosciutto, Goat Cheese, and Fig Sandwiches ",236.0
Chicken and Artichoke Stew ,1385.0
Vegetable Soup with Basil and Garlic ,1313.0
"Mint-Marinated Shrimp with Tabbouleh, Tomatoes, and Feta ",564.0
Orange-Pineapple Carrot Cake ,660.0
Curried Peanut Soup ,490.0
Salt-Encrusted Beef Tenderloin ,
Grilled Skewered Scallops and Apricots with Honey-Mustard Dressing ,
Poblano Cream Soup ,54.0
Scalloped Potatoes with Blue Cheese and Turnips ,
Green Curry With Brown Rice Noodles and Swiss Chard ,756.0
"Cabbage Packages Filled with Creamed Onions, Bacon and Sage ",215.0
"Sausage and White Bean ""Cassoulet"" ",771.0
Asparagus and Leek Risotto with Prosciutto ,539.0
Blueberry Compote ,179.0
Pan-Roasted Carrots with Miso-Butter ,
Baja Fish Tacos ,
"Grilled Swiss Cheese, Tuna and Red Pepper Sandwiches ",777.0
Miso Glazed Sea Bass ,273.0
Hot and Sweet Mango Salsa ,
"Seared Halibut with Haricots Verts, Scallions, and White Wine Sauce ",509.0
Watercress Salad With Warm Mustard Dressing ,135.0
Ham and Horseradish Stuffed Eggs ,39.0
Lemon Meringue Ice Cream Pie in Toasted Pecan Crust ,571.0
Ginger-Lime Coconut Cake with Marshmallow Frosting ,1159.0
Braised Escarole with Currants and Pine Nuts ,130.0
Fiorentini with Butternut Squash ,
Cream of Jerusalem Artichoke and Celery Soup ,311.0
Fresh Vegetable Platter with Olive Oil Dip ,1.0
Winter Salad with Toasted Mustard Seed Vinaigrette ,145.0
Satan's Circus ,
Asparagus Roast Beef Roll-Ups ,
"Red Snapper with Thyme, Tomatoes, and Olives ",
Alt-Grain Porridge With Sausages and Grapes ,
Mexican Pineapple Salad ,343.0
Tom and Jerry ,336.0
Mustard Scallion Potato Salad ,219.0
Sautéed Savoy Cabbage with Scallions and Garlic ,148.0
Crab & Sweet Corn Cakes ,303.0
Chocolate Velvet Ice Cream ,262.0
Ham Mousse in Sherry Aspic ,291.0
Sausage-Stuffed Rack of Pork with Sage ,
Dilly Bean Potato Salad ,
Fresh Pasta With Clams And Hot Italian Sausage ,
Spring Greens Sauté with Bacon and Walnuts ,99.0
Radicchio Salad With Caramelized Carrots and Onions ,284.0
Sauteed Swiss Chard with Onions ,101.0
Orange-Flower Pavlovas with Strawberries ,181.0
Grilled Sausages with Figs and Mixed Greens ,
Roasted Sweet Potatoes with Honey Glaze ,335.0
Honey Apple Pie with Orange Lattice Crust ,493.0
"Game Hens with Honey, Vinegar and Spice Glaze ",1439.0
Sweet and Sour Pork ,661.0
Lentil Stew with Spinach and Potatoes ,601.0
Pistachio-Crusted Scallops ,318.0
Bucatini All'Amatriciana ,755.0
Dill-Pickled Vegetables ,232.0
Applesauce Cake with Penuche Frosting ,358.0
"Red Onion, Parsley, and Preserved Lemon Salad ",151.0
Filets Mignons with Mustard Port Sauce with Red Onion Confit ,628.0
Fast Favorite Garlic Dill Pickles ,76.0
Dilled Spinach Crepes with Avgolemono Sauce ,440.0
Avocado and Tropical-Fruit Salsa ,176.0
Honey-Mustard Chicken-Sausage Kebabs ,194.0
Soy and Sesame Short Ribs ,1190.0
Kohlrabi Pickles With Chile Oil ,64.0
Fresh Tomato Salsa ,
Asparagus with Wasabi-Mayonnaise Dip ,319.0
Cuban-Style Roast Suckling Pig ,2986.0
Meringue-Topped Raspberry and Peach Ice Cream Cake ,704.0
Garlic Bruschetta ,201.0
"Cheddar Biscuits with Fried Eggs, Ham, and Brown Butter ",324.0
Pinon ,798.0
Lemon Crostata ,576.0
Frozen Chocolate Bourbon Parfaits ,454.0
Grilled Quail Salad with Honey-Dijon Dressing ,596.0
Parmesan Walnut Salad in Endive Leaves ,27.0
Citrus Syrup ,70.0
Corn Bread Succotash Stuffing ,150.0
Southeast Asian Squid Salad ,397.0
Panettone Bread and Butter Pudding ,496.0
"Beets with Goat Cheese, Nigella Seeds, and Pistachios ",
Cinnamon-Walnut Coffee Cake ,332.0
Ultimate Turkey Stock ,314.0
Saffron Mayonnaise ,201.0
Apple and Nut-Butter Puff Pastry Tarts ,
"Cranberry, Pear, and Ginger Chutney ",233.0
Fresh Fennel and Arugula With Meyer Lemon Dressing ,
Frozen Iced Coffee With Coffee Jelly ,253.0
Paniolo Rack of Lamb ,849.0
Asian Chicken Salad ,815.0
Potato Parsnip Mash ,328.0
Salt-Crusted Beets with Horseradish Crème Fraîche ,198.0
Black and White Crème Brûlée ,304.0
"Lemon, Sage, and Garlic Roast Chicken ",456.0
"Lobster, Scallops, and Mussels with Tomato Garlic Vinaigrette ",802.0
"Butter Beans with Butter, Mint, and Lime ",
Raisin Scones ,273.0
Blackberry-Gin Fizz ,212.0
Ramp and Walnut Pistou ,
Waffles with Frizzled Ham and Maple-Mustard Cream ,746.0
Chili-Seasoned Fish Sticks ,589.0
Zinfandel Beef Stock ,26.0
Warm Almond Cakes With Grapes ,518.0
Mirabelle Ginger Tart ,339.0
Lamb Chops with Feta and Banyuls-Cherry Sauce ,1027.0
Sticky Cinnamon Rolls ,307.0
Northwestern Wild Mushroom Stuffing ,290.0
Plantain Flatbread With Poached Egg and Honey Drizzle ,
Lamb Köfte with Yogurt Sauce and Muhammara ,
Assorted Vegetables ,102.0
Ginger Syrup ,237.0
Rice Pilaf with Pistachios and Golden Raisins ,282.0
Pasta with Confit Duck and Savoy Cabbage ,1177.0
Rosemary Citrus Miso-Rubbed Turkey ,841.0
Herbed Orzo with Toasted Pine Nuts ,315.0
Glazed Red Pepper-Fennel Almonds ,170.0
Spiced and Steamed Couscous With Brown Butter ,349.0
Baked French Toast with Cardamom and Marmalade ,468.0
Chamomile Crème Anglaise ,185.0
Frozen Strawberry-Banana Cake with Strawberry Sauce ,412.0
Sour Cream Cake with Cardamom and Pistachios ,444.0
"Spinach, Basil Ricotta Purée ",189.0
Lemon Cloud ,132.0
Chocolate Profiteroles with Coffee Ice Cream and Bittersweet Chocolate Sauce ,160.0
Maraschino Cherry Parfaits ,602.0
Spiced Peaches and Raspberries ,91.0
Mixed Grill with Cherry Cola Barbecue Sauce ,885.0
Shrimp with Ginger-Herb Butter ,
"Cranberry Sauce with Cherries, Marsala and Rosemary ",301.0
Three-Cheese Pizza with Pancetta and Mushrooms ,
Molasses-Cured Pork Shoulder Bacon ,
Baked Pecan-Stuffed Nectarines ,265.0
Chicken Sauté with Sherry ,1012.0
Raspberry Galettes ,812.0
Agnolotti with Sweet Peas and Goat Cheese ,527.0
Mango-Pineapple-Lime Cheesecake with Ginger Crust ,590.0
Aged Sherry-Walnut Vinaigrette ,203.0
Polenta Toasts with Goat Cheese and Fresh Thyme ,38.0
Spiced Pork Tenderloin With Cherry-Thyme Pan Sauce ,760.0
Mustard-Crusted Pork With Farro and Carrot Salad ,850.0
Challah ,362.0
"Penne with Pancetta, Sage, and Mushrooms ",796.0
Seafood Stew with Leeks and Garlic ,
"Arugula, Fennel, and Parmesan Salad ",
Candied Butternut Squash ,226.0
Steamed Japanese Rice ,351.0
Santori ,6145.0
Orzo Risotto ,187.0
Spiced Mixed Nuts ,224.0
Eggplant Salad with Miso Ginger Dressing ,455.0
Halibut in Chard Leaves with Lemon-Thyme Butter ,400.0
Chimichurri Sauce ,392.0
Vietnamese Fried Rice ,185.0
Black-Eyed Pea and Bacon Salad with Mustard Vinaigrette ,358.0
Hummus Tehina ,151.0
Spaghetti with Lobster and Mussels ,279.0
Rosanne Cash's Potato Salad ,334.0
Farinata con Salvia ,259.0
Raspberry and Peach Parfait Cake ,1148.0
"Arugula Salad with Caramelized Onions, Goat Cheese, and Candied Walnuts ",
Best Friends Forever Brownies ,229.0
Sugar Snap Salad ,111.0
Raisin Ginger Breads ,294.0
Pesto ,751.0
Herbed Rice ,359.0
Ginger-Chili Dipping Sauce ,110.0
Preserved Lemons ,
Chicken with Lemons and Olives Emshmel ,
Orange Tangerine Pudding ,174.0
To Zest Citrus Fruits ,
Ras El Hanout ,17.0
Grilled Fish with Orange-Fennel Salsa ,435.0
Fresh Tomato Bruschetta ,
Chocolate Hazelnut Spiced Cookies ,110.0
Red Bell Pepper and Tomato Salad ,117.0
Turkey Osso Buco ,643.0
Lemon-Nutmeg Custards ,
Dried Fruit Stewed with Brown Sugar and Vanilla ,137.0
Warm Teriyaki Beef Salad ,493.0
Rice Pudding Cake with Cherry-Apricot Compote ,305.0
Broccoli with Garlic and Parmesan Cheese ,185.0
Buttermilk Ice Cream with Spiced Fruit Compote ,
Chocolate Mint Layer Cake ,
Cinnamon Blueberry Muffins ,177.0
Lamb Shank Ragù with Anson Mills Grits ,628.0
Fragrant Orange Chicken with Scallion Mashed Potatoes ,
Maple Cheesecake with Maple-Cranberry Compote ,
Steamed Asian White Rice ,263.0
Tropical Punch Colada ,498.0
Couscous with Lamb Stew ,1241.0
Turkey Congee With Crispy Shiitake Mushrooms ,782.0
Old-Fashioned Chicken and Corn Stew ,452.0
Egg Tacos with Pumpkin-Seed and Tomato-Habanero Sauces ,504.0
Mango in Ginger-Mint Syrup ,
Sausage and Potato Breakfast Casserole ,421.0
Chocolate Truffle Pie with Orange-Champagne Sabayon and Strawberries ,
Maple Syrup Pie ,
Lemon Mascarpone Brûlée Tarts with Raspberry Sauce ,968.0
Fresh Hot-Pepper Paste ,138.0
Grilled Ground Lamb Kebabs with Fresh Hot-Pepper Paste ,166.0
Gingerbread with Nectarines and Cream ,1388.0
Crispy Chicken Sandwich with Buttermilk Slaw and Herbed Mayo ,2448.0
Crisp Chocolate Marshmallow Squares ,38.0
Spring Vegetable Ragoût with Fresh Chervil ,112.0
Farro Spaghetti with Mushrooms and Hazelnuts ,603.0
"Roasted Potatoes with Garlic, Lemon, and Oregano ",560.0
Marinated London Broil with Lemon and Garlic ,510.0
Potato Pancakes with Confit Duck and Red-Cabbage Beet Slaw ,369.0
Curried Chicken ,653.0
White Wine and Peach Sangria ,389.0
Milk Pie ,428.0
Grilled Skirt Steak Tacos with Roasted Poblano Rajas ,88.0
"Fettuccine with Asparagus, Beet Green Pesto, and Poached Egg ",504.0
Roasted Beet Salad with Flash-Pickled Radishes and Chard ,286.0
Beet Risotto ,584.0
Radish and Carrot Salad with Tuna and Capers ,348.0
Sage Buttermilk Biscuits with Sausage and Cheddar ,472.0
Frittata with Fennel-Spiced Pork and Asparagus ,703.0
"Chicken, Green Bean, Corn, and Farro Salad with Goat Cheese ",390.0
Tomales Bay Oysters Rockefellar ,92.0
Parmesan Shortbread with Fennel and Sea Salt ,181.0
Grits with Shrimp and Roasted Red Bell Pepper ,291.0
Agnolotti with Meat and Spinach Filling ,519.0
Bourbon Sloe Gin Cocktail ,188.0
Mexican Coffee ,189.0
"Smoked Fish with Cucumber ""Noodles"" ",234.0
Potato Salad with 7-Minute Eggs and Mustard Vinaigrette ,235.0
Sour Cherry Strudels ,448.0
Spring Fever ,
Creamy Garlic Pasta with Mushrooms and Prosciutto ,598.0
"Burnt Carrots with Goat Cheese, Parsley, Arugula, and Crispy Garlic Chips ",456.0
"Fettuccine with Chicken, Red Onion and Peppers ",1135.0
Potted Cheese Spread with Crackers ,205.0
"Cod with Lemon, Green Olive, and Onion Relish ",458.0
Beef Tenderloin with Morels and Tarragon-Marsala Sauce ,
Vanilla Whipped Cream ,168.0
"Beef Brisket Braised with Dried Fruit, Yams and Carrots ",1107.0
Grilled Sausages with Chunky Tomato Porcini Sauce ,540.0
Chicken Marsala with Sage ,494.0
Spicy Pecans ,322.0
Frozen Milk Chocolate and Amaretto Mousse Pie ,438.0
"Apple, Celery, and Walnut Salad ",
Roast Turkey with Pesto-Rice Stuffing ,1401.0
Mexican Chicken Salad ,1220.0
"Mushroom, Squash and Bell Pepper Salad ",364.0
Salted Brown Butter Cookies ,136.0
Four-Cheese Pasta with Cauliflower ,
Smoked Trout and Arugula Toasts ,146.0
Green Goddess-Chive Dressing ,398.0
Braised Chicken with Green Peppers and Tomatoes ,520.0
Pastry Dough ,230.0
Grilled Lamb with Curried Vegetables and Grape Pine Nut Gremolata ,3616.0
Linguine with Garlic Shrimp and Basil ,694.0
California Barley Bowl with Lemony Yogurt Sauce ,
Farfalle with Tuna and Rosemary Mushroom Sauce ,
Passion Fruit “Crumble” ,172.0
Mexican Floating Island with Kahlua Custard Sauce and Sesame Pumpkin-Seed Brittle ,277.0
Spice-Rubbed Pork Tenderloin With Roasted Baby Carrots ,121.0
Turkey Giblet Stock ,120.0
Blueberry-Lemon Icebox Cake ,426.0
"Crunchy Chicken Salad with Shiitake Mushrooms, Spicy Sesame Dressing and Peanuts ",464.0
Free-Form Beesting Cake ,989.0
Spicy Soy Glaze ,
Roasted Strawberries ,152.0
Caramelized Fresh Pineapple Tiramisu ,372.0
"Tequila, Apple, and Dried Cranberry Compote ",248.0
Potato and Carrot Gratin Diamonds ,304.0
Tomato-Avocado Salsa ,96.0
Indian-Spiced Pickled Vegetables ,200.0
Grilled Pork Chops with Sweet Lemongrass Marinade ,458.0
Romaine and Red Onion Salad with Parmesan Balsamic Vinaigrette ,383.0
Curried Bean and Bell Pepper Soup ,239.0
Modern Sausage Sandwich with Ginger and Mustard Relish ,
French Bread Pudding ,
Thai Chicken and Shrimp Noodle Salad ,
Verjus Relish ,169.0
Greens-Filled Ravioli with Walnuts ,1254.0
Wine-Braised Red Cabbage ,147.0
Linguine with Summer Peppers and Sausage ,
Lima Bean Purée ,186.0
Stuffed Sweet Potatoes ,254.0
Creamy Slaw ,207.0
Primavera Risotto Nests with Fried Eggs ,
Crispy Chicken Wings ,582.0
Skewered Rosemary Shrimp with Mint Pesto ,713.0
Sweet Pastry Dough ,196.0
Apple and Cranberry Crisps with Ginger-Pecan Topping ,576.0
Rigatoni with Eggplant and Pine Nut Crunch ,671.0
Marmalade Cake ,505.0
Chili-Rubbed Baby Back Ribs with Espresso Barbecue Sauce ,1312.0
Steamed Mussels with Tomato and Chorizo Broth ,25.0
Chunky Beef and Vegetable Soup ,372.0
"Grilled Artichokes with Olive Oil, Lemon, and Mint ",342.0
Oval Masa Cakes with Goat Cheese Filling ,
Applejack Spritzer ,138.0
Trout with Tropical Fruit Salsa and Mixed Greens ,486.0
Winter Fruit and Nut Stuffing ,2473.0
"""Coffee and Doughnuts"" ",
Lean Lasagna ,
Cowboy Frittata ,248.0
Beef and Potato Supper Pot ,
Brandied Black Cherries ,482.0
Cardamom Crescents ,84.0
"Banana, Coffee, Cashew, and Cocoa Smoothie ",124.0
Butternut Squash Pizza ,
Tom Valenti's Lamb Shanks ,
Mac Sauce (Béchamel 101) ,248.0
Spiced Rice Basmati ,129.0
Sage and Pancetta Biscuits with Fontina Cheese ,208.0
Champagne Punch ,251.0
Green Onion Sausage and Shrimp Gravy ,359.0
Slow-Cooked Veal Grillades ,
Ginger-Garlic Shrimp ,172.0
Chilled Watermelon Soup ,
Black-Olive Yogurt Cheese with Flatbread ,
Cream Cheese ,
Chocolate Raspberry Shake ,188.0
Margarita Chicken ,111.0
"Eggplant Steaks with Salad of Roasted Peppers, Olives, Feta and Garbanzo Beans ",367.0
Shallot Vinaigrette ,
Chicken Liver Pâté ,
Turkey Burgers with Chipotle-Chili Tartar Sauce ,718.0
"Fava Bean, Radish, and Corn Salad ",
Smoky Two Chile Salsa ,14.0
Butterscotch Blondie Bars With Peanut-Pretzel Caramel ,255.0
Grilled Citrus Salmon ,
Pan-Fried Flounder with Potatoes in Parsley ,620.0
Honeydew in Cardamom Lime Syrup with Vanilla Cream ,
Green Olive and Goat Cheese Crostini ,83.0
Pan Seared Sea Scallops with Chorizo and Fu Fu ,1052.0
"Couscous Salad with Currants, Pine Nuts, and Celery ",438.0
Cheese Toast ,
Chana Masala ,
Pizza Dough ,1577.0
Grilled Leg of Lamb with Rosemary Salt ,916.0
"""Pot Roast"" of Seitan, Aunt Gloria-Style ",528.0
Yogurt Cake with Currant Raspberry Sauce ,879.0
Quinoa Stir-Fry with Vegetables and Chicken ,
Citrus-Cured Salmon ,416.0
Raspberry Zing Syrup ,206.0
Salt-Grilled Shrimp ,175.0
Cheddar Dill Biscuits ,153.0
Salmon and Vegetable Chowder ,517.0
"Beef Tenderloin Medallions with Potato ""Risotto"" ",
Golden Slipper ,171.0
Brown Rice and Barley ,284.0
"Roast Chicken with Rosemary, Lemon, and Honey ",1620.0
Basil-Mint Sauce ,408.0
Cantaloupe and Prosciutto with Basil Oil ,309.0
"Braised Bacon, Pomegranate, and Pine Nut Relish ",663.0
Chilled Corn Soup with Crab and Chile Oil ,142.0
Grilled Lamb Kebabs with Coriander and Cumin ,880.0
Three-Cheese Mushroom and Spinach Calzone ,
Broiled Duck Breasts with Orange Chipotle Sauce ,356.0
Dandelion Greens with Hot Olive-Oil Dressing ,244.0
Soy-Glazed Shiitake Mushrooms ,43.0
"Arugula, Pear and Stilton Salad ",357.0
Baked Irish Bacon with Kumquat Glaze ,
Shaved Fennel and Arugula Salad ,
Balsamic Strawberries ,180.0
