Food,Calories
Hazelnut Praline ,206.0
Chocolate Hazelnut Praline Torte with Frangelico Whipped Cream ,
Caramelized Apple and Pear Pie ,3358029.0
Norma Naranjo's Tamales ,
Canyon Ranch Grilled Portobello Sandwich with Roasted Peppers ,
Pork Chops with Apple Balsamic Sauce and Blue Cheese Tomato Gratin ,837.0
Apricot Stars ,8.0
Coconut Cream Pie with Macaroon Press-In Crust ,272.0
Marinated Vegetables with Mustard Dill Dressing ,157.0
Modern Waldorf Salad ,
Confetti Rice with Baked Tofu and Green Onion Omelet Strips ,
Toasted Blue Cheese and Caramelized Onion Sandwiches ,89.0
Grilled Steak with Parsley-Parmesan Salad ,335.0
Roasted Potatoes with Sour Cream and Bacon ,346.0
"White Bean, Sun-dried Tomato, and Feta Bites ",126.0
Pot Roast with Caramelized Onions and Roasted Carrots ,1462.0
Potato Chowder ,217.0
Broccoli Rabe with Bulgur and Walnuts ,
Scallop and Vegetable Stir-Fry ,411.0
"Roasted Chicken, Bell Pepper and Onion Salad ",694.0
Sea Salt-Roasted Pecans ,279.0
Frozen Nougat Terrine with Bittersweet Chocolate Sauce and Raspberry-Fig Sauce ,
Tomatillo Salsa ,50.0
Pork Scaloppine with Herbed Noodles ,608.0
Kale with Garlic and Bacon ,190.0
Coconut Milk Whipped Cream ,141.0
Poached Halibut with Black Truffles and Purple-Potato and Crab Gratin ,
Rosemary and Cranberry Soda Bread ,
Jalapeño-Cilantro Salsa ,986.0
Pasta with Creamy Wild Mushroom Sauce ,
Pesto Goat Cheese Spread ,241.0
Custard Sauce ,202.0
To Render Beef Suet ,194.0
Suet Pastry Dough ,195.0
Candied Orange Zest ,260.0
Belize-Style Sweet Potato Pudding ,
Fennel-Saffron Compote ,174.0
Spotted Dick ,
Honey-Ginger Barbecue Sauce ,298.0
Brown Chicken Stock ,128.0
Baked Spiced Butternut Squash with Apples and Maple Syrup ,283.0
Turkey Gravy ,504.0
Rosemary-Roasted Turkey with Gravy ,1450.0
No-Bake Chocolate Biscuit Cake with Dried Cherries ,391.0
Garden Greens and Goat Cheese Pasta ,544.0
Watermelon-Honeydew Kebabs with Lime-Poppy Seed Dressing ,
"Tacos of Carnitas Roasted with Orange, Milk, and Pepper ",
Shrimp with Snow Peas ,263.0
Classic Sour Cherry Pie with Lattice Crust ,548.0
Seafood Canapes with Lemon-Chive Butter ,50.0
Sake-Marinated Sea Bass with Coconut-Curry Sauce ,
Squash and Sweet-Potato Soup with Chipotle Sauce ,68.0
Chocolate-Caramel Tartlets with Roasted Bananas and Ginger-Citrus Caramel ,1051.0
Plum Almond Tartlets ,562.0
Green Juice with Baobab Powder ,166.0
Brisket Braised in Porter ,
Buckwheat Crêpe Noodles with Chive Butter ,286.0
Philadelphia Fish House Punch ,222.0
Bourbon Sauce ,995.0
Spinach Linguine with Goat Cheese ,817.0
Cognac-Glazed Dried Apricots with Cinnamon-Spiced Yogurt ,246.0
Baby Squash Sauté Szwarc ,106.0
Roasted-Tomatillo and Lime Salsa ,49.0
Aunt Tom's Italian Cream Cake ,377.0
Roast Fresh Ham ,91.0
Jalapeño-Goat-Cheese Hush Puppies ,95.0
Strawberry Italian Ice ,144.0
Orange-Scented Bittersweet Chocolate Cake with Candied Blood Orange Compote ,
Bacon Cheddar Quick Bread with Dried Pears ,473.0
Chocolate Almond Sherry Cake with Caramelized Pears ,210.0
Sausage and Egg Casserole with Sun-Dried Tomatoes and Mozzarella ,424.0
Chocolate Pecan Dollars ,54.0
Nectarine-Raspberry Crisp with Spiced-Oatmeal Crumb Topping ,431.0
Croissant Steak Sandwiches with Caramelized Onions and Horseradish Mayonnaise ,3155.0
Garlic-Herb Mashed Potatoes ,241.0
Vegetable Broth ,10.0
All-Butter Pastry Dough ,1378.0
Potato and Porcini Gratin ,239.0
Sweet Potato Gnocchi with Fried Sage and Shaved Chestnuts ,391.0
Roasted Poblano-Cream Soup ,203.0
"Chicken Skin With Peanuts, Chiles, and Lime ",
"Toasted Orzo with Peas, Onion and Bacon ",316.0
"Tunisian Bell Pepper, Tomato, Tuna and Egg Salad ",218.0
"Veal Shanks, Artichoke Hearts, and Chick-Peas with Preserved Lemon ",2685.0
Celery and Parsnip Soup with Green Onion-Dill Matzo Balls ,167.0
Concord Grape Sorbet With Rosemary And Black Pepper ,221.0
Poached Pears with Sweet Wine and Fruit Confetti ,
Spicy Soba Noodles with Shiitakes and Cabbage ,495.0
Hungarian Chocolate Mousse Cake Bars ,230.0
Goat Cheese Souffles and Mixed Greens with Raspberry Vinaigrette ,256.0
Linguine with White Clam Sauce ,810.0
"Herb-Basted Chicken with Pearl Barley, Bacon, and Root Vegetable Pilaf ",795.0
Ham Braised with Maple Raisin Sauce ,1122.0
Dirty Rice Stuffing ,414.0
Crimson Royale ,170.0
Black-Eyed Pea and Pumpkin Salad ,189.0
Roast Duck Breast with Balsamic and Apricot Sauce ,313.0
Yucatecan-Style Pork ,
Thyme Pesto ,851.0
Shrimp Stuffed Avocado ,
"Arugula and Mint Salad with Oil-Cured Black Olives, Oranges, and Ricotta Salata ",218.0
Crab Cakes with Tomato Cream Sauce ,1685.0
Pizza Dough ,580.0
Sweet Potato Pudding with Pecan and Gingersnap Topping ,251.0
Creamed Kale with Crispy Shallots ,
"Watercress, Celery, and Red Onion Salad ",221.0
Pork Tenderloin with Mango Chutney ,
"Baked Halibut with Paprika,olives and Mushrooms ",320.0
"Steamed Snapper with Ginger, Lime, and Cilantro ",283.0
Sazerac ,200.0
Onion and Bacon Tart ,511.0
Cooked Rice ,439.0
Bourbon Balls ,
Red-Wine-Braised Duck Legs with Roasted Pears and Onions ,1711.0
"Chicken, Sausage, and Okra Gumbo ",821.0
Chicken with Cranberry-Mustard Sauce ,552.0
Asparagus and Prosciutto Bundles ,20.0
Cantaloupe Basil Salsa ,93.0
Rice and Lentil Salad with Orange and Dried Cherries ,296.0
Endive with Smoked Trout and Herbed Cream Cheese ,32.0
Spiced Cranberry-Pear Tart ,916.0
Tangerine-Date Tartlets with Buttermilk Whipped Cream and Tangerine Granita ,753.0
Chocolate-Banana Tarts ,
Spanakopita ,73.0
Heirloom Tomato Salad ,83.0
Miso-Glazed Tuna Kebabs ,
"Slow-Cooked Salmon, Chickpeas, and Greens ",778.0
Herb Salt ,2.0
Bittersweet Chocolate Sauce ,865.0
Pickled Pears ,
Watermelon-Lime Sorbet ,107.0
Apricot-Riesling Jam ,
Bittersweet Chocolate Sauce ,470.0
Shrimp Creole ,492.0
Grilled Pork Kebabs with Ginger Molasses Barbecue Sauce ,200.0
"Pepper-Crusted Beef, Bacon, and Arugula Sandwiches with Spicy Mustard ",763.0
Chilled Coconut Corn Soup ,1702.0
Passion-Fruit Nieve ,223.0
Bruschetta with Roasted Red Bell Peppers ,
"Figs with Balsamic Vinegar, Mascarpone, and Walnuts ",282.0
Grilled Hoisin-Soy Steaks with Shiitake and Bok Choy ,735.0
"Modern Chop Suey with Shallots, Ginger, and Garlic Essence ",228.0
Nectarine-Red Wine Sauce ,141.0
"Farfalle with Four Cheeses, Carrots, Peas and Prosciutto ",768.0
Crown Roast of Pork with Sausage Stuffing ,
Meyer Lemon Marmalade ,
Pineapple Pork Chops ,378.0
Dill Sauce ,231.0
"Rigatoni with Brie, Grape Tomatoes, Olives, and Basil ",454.0
Shrimp with Zucchini Fritters and Grape-Leaf Spread ,93.0
Homemade Sweet-and-Sour Mix for Margaritas ,319.0
Honey Mustard Dressing ,168.0
Veal Cutlets with Sauteed Baby Artichokes ,426.0
Whipped Chipotle Sweet Potatoes ,307.0
Lemon Curd Mousse with Toasted Coconut and Blueberries ,724.0
Baked Risotto with Roasted Vegetables ,493.0
Mashed Potatoes with Leeks and Garlic ,334.0
Spicy Tortilla Strips ,189.0
Crackling Corn Bread Dressing ,261.0
Brown Rice and Beans with Ginger Chile Salsa ,
Flank Steak with Chimichurri ,459.0
Leek and Celery Pie ,455.0
"Artichoke, Potato, and Portobello Mushroom Casserole ",296.0
Black Grape Compote ,175.0
Linguine with Tomatoes and Artichoke Hearts ,603.0
Pasta Primavera ,588.0
Cole Slaw ,143.0
Beef Empañadas ,1003.0
Fiesta Tortilla Salad ,805.0
Creamy Baked Polenta with Herbs and Green Onions ,312.0
"Linguine with Red, Yellow, and Orange Tomatoes ",
"Crispy Skate with Cauliflower, Bacon, Capers, and Croutons ",879.0
Orange-Roasted Baby Carrots with Honey ,153.0
Thanksgiving Skillet Pizza ,
Lemon Blueberry Cobbler ,479.0
Walnut Spice Cake with Lemon Glaze ,464.0
Sauteed Duck Breast with Figs and Port ,2174.0
Pineapple-Citrus Juice ,122.0
Fruit Kebabs with Vanilla Mint Yogurt Sauce ,
Dukkah-Crusted Lamb Chops with Pomegranate Molasses ,689.0
Fresh Lime Tart with Meringue Lattice and Glazed Berries ,535.0
Tropical Glazed Ham with Curried Pineapple Chutney ,619.0
Chicken and Spelt Soup with Greens ,1029.0
Peachy Grilled Chicken Salad ,465.0
Chilled Crab Cakes with a Tropical Fruit Coulis ,250.0
"Mixed Citrus ""Marmalade"" ",
Pistachio Cardamom Butter Cookies ,95.0
Dark Chocolate Orange Soufflé with White Chocolate Chunk Whipped Cream ,657.0
Wakame ,2.0
Pork Tenderloin with Pomegranate Sauce ,
Microwave Brown Roux ,
Fish Fillets in Mole Verde ,308.0
Chicken-Pine Nut Dumplings with Chili-Chili Dipping Sauce ,118.0
Oatmeal Praline Ice Cream with Warm Berry Sauce ,671.0
Shortcut Turkey Stock ,162.0
Italian Sausage and Tortellini Soup ,319.0
Cheddar Cheese Biscuits ,404.0
Wasabi Lime Crab Salad in Cucumber Cups ,15.0
Pea and Parmesan Wonton Ravioli ,627.0
Ricotta-Pumpkin Gnocchi With Brown Butter ,792.0
Rhubarb Charlotte ,487.0
Roasted Chicken with Dijon Sauce ,833.0
Grilled Teriyaki Pork Chops with Pineapple Papaya Relish ,
Lemon-Oregano Chicken ,589.0
Eggplant Parmesan ,964.0
Ziti with Kielbasa and Sauerkraut ,521.0
"Trout with Red Cabbage, Jicama, and Chipotle Slaw ",
Oysters with Spicy Jícama Salad ,438.0
Spiced Rum No. 5 ,417.0
Fresh Corn Spoon Bread ,193.0
Ras-El-Hanout ,20.0
Beef Rolls with Ham and Vegetables Stuffing ,530.0
Green-Peppercorn Cornmeal Crackers ,32.0
Veal Marsala ,510.0
Deviled Crab Tart ,331.0
Lime-Saffron Syrup ,199.0
Acini di Pepe Pasta with Garlic and Olives ,209.0
Cilantro-Chipotle Tilapia ,233.0
Creamy Scrambled Eggs with Spinach ,237.0
Honey Barbequed Salmon with Mâche ,655.0
Curried Egg Salad ,147.0
"Soba with Pea Shoots, Shiitake Mushrooms, and Leeks ",395.0
Shrimp with Mango Sauce ,
Lemon Olive-Oil Cake ,369.0
Roasted Peperonata ,100.0
Fettuccine With Artichokes ,433.0
Chicken With Olive Tapenade ,
Red-Wine-Braised Duck Legs ,
Lemon Pudding ,
Figs in Red-Wine Syrup ,127.0
Scallops with Apple-Curry Sauce ,330.0
Green Salad with Olives ,215.0
Broccolini with Italian Herb Oil ,
Fennel and Celery Salad with Pumpkin Seeds ,
Napa Valley Cabernet Burgers ,1314.0
Jerk Chicken ,
"Baked Apples with Toffee, Bourbon and Molasses ",220.0
"Pear, Blue Cheese, and Fig Napoleons ",174.0
Grilled Lamb Loin With Tomato and Cucumber Raita and Israeli Couscous ,
Roasted Sweet Potatoes with Mushrooms and Shallots ,
Barbary Coast ,333.0
"Spinach, Basil Ricotta Purée ",189.0
Basic Oven-Baked Marinated Tempeh ,
Sachertorte ,
Sliced Baked Ham with Camembert Sauce ,
Parmesan Onion Puffs ,45.0
Beef Tenderloin with Goat Cheese Sauce ,788.0
"Pasta with Shrimp, Tomatoes and Arugula ",
Imperial Peach Sundaes ,
Zucchini Cones Filled with Lemon Mint Pea Purée ,10.0
Jamaican Coffee Brownies with Pecans ,359.0
Scallops with Asian Noodle Salad ,376.0
Pear and Apple Crostata with Five-Spice Whipped Cream ,558.0
Portuguese Corn Bread ,236.0
"Watermelon, Strawberry, and Mint Smoothie ",
Streusel-Roasted Plums with Vanilla Ice Cream ,212.0
Apple Ginger Upside-Down Cake ,244.0
"Green Bean, Orange, and Green Olive Salad ",107.0
Braised Lamb Shanks with White Beans ,1549.0
Greek Honey and Anise Twists ,86.0
Grilled Whole Turkey ,
Mustard Dill Sauce ,278.0
Tropical Margarita ,162.0
Mixed-Mushroom and Tarragon Gravy ,223.0
Pearl Oyster Bar Tartar Sauce ,402.0
Mango Curry Truffles ,
Egg Sponge ,158.0
Sweet Pastry Dough ,197.0
Tuscan Kale with Sesame Oil ,
Ginger Cakes with Molten Chocolate Centers and Ginger Crème Anglaise ,721.0
Pumpkin Mustard Relish ,254.0
Crab Cakes with Herb Salad ,151.0
Smoked Whiskey Wings ,422.0
Anise Cookie Baskets with Riesling Ice Cream and Fresh Fruit ,653.0
Rosemary-and-Pepper Standing Rib Roast with Two-Mushroom Pan Sauce ,1807.0
Sweet Potato Salad with Chili-Lime Dressing ,271.0
Quick Apple Tart ,589.0
Grilled Chicken with with Tamarind-Orange Glaze ,644.0
Herb- and Spice-Roasted Beef Tenderloin with Red Wine-Shallot Sauce ,815.0
Golden Colcannon Pie ,244.0
Red Currant-Glazed Turkey with Sage and Red Currant Gravy ,
Crunchy Wasabi-Crusted Fish with Red-Cabbage Slaw ,460.0
Maple Syrup Candies ,273.0
Garlic Anchovy Artichoke Hearts ,275.0
Roasted Chicken with Garbanzo Ragoût and Gremolata ,889.0
Pesto From the Sea ,152.0
Seafood and Fennel Soup ,427.0
"New England Blackberry ""Torte"" ",394.0
Slow-Roasted Chicken With All the Garlic ,
"Tagliatelle with Spotted Sardines, Eggplant, and House-Baked Ricotta Salata ",1881.0
Pasta with Spring Vegetables and Prosciutto ,350.0
Spicy-Sweet Tangerine Shrimp with Baby Bok Choy ,224.0
Austrian Sweet Cheese Crepes Baked in Custard ,433.0
Vegetable and Tofu Red Curry ,616.0
"Tagliatelle with Shredded Beets, Sour Cream, and Parsley ",560.0
Date Paste ,275.0
Moroccan Lamb Kebabs with Golden Couscous ,759.0
Julia's and Jacques's Deglazing Sauce for Roast Chicken ,67.0
"Spinach, Feta, and Pine-Nut Phyllo Tart ",522.0
Anise-Scented Fig and Date Swirls ,97.0
Mutabal ,205.0
Coleslaw with Bay Shrimp and Tarragon ,338.0
Veal Scaloppine with Mushroom Cream Sauce ,416.0
Mint-Chocolate Ice Cream Sandwich Cake ,483.0
Cioppino ,414.0
"Butter Lettuce Salad with Bacon, Dried Cherries, and Roquefort Vinaigrette ",399.0
Turkey Enchiladas with Red Chili Sauce ,838.0
Hanger Steak with Shallots ,511.0
Olive-Oil-Poached Salmon and Braised Artichokes with Sauvignon Blanc ,5656.0
Lamb and Broccoli Stew ,1321.0
Manhattan-Style Seafood Stew ,935.0
Salmon Wrapped Poached Eggs ,389.0
Hazelnut-Cinnamon Biscotti ,117.0
Pasta with Butternut Squash and Sage ,656.0
Berry Compote with Crispy Won Ton Strips and Vanilla Ice Cream ,596.0
Grilled Butterflied Leg Of Lamb With Fresh Mint-Pepper Jelly ,
"Fried Squid, Papaya, and Frisée Salad with Spicy-Sour Dressing ",
Scandinavian Yellow Pea Soup ,1157.0
Caraway Cabbage Chips with Dill Yogurt ,107.0
Sautéed Green Beans and Brussels Sprouts with Chile and Mint ,99.0
Roast Chicken with Maple-Soy Glaze ,4718.0
Toast with Tomato-Butter and Marjoram ,
"Mixed Citrus ""Marmalade"" ",
Rib Eye Roast ,
Mussels with Shallots and Tarragon ,332.0
Lemon Crème Brûlée Tart ,318.0
Wine-Braised Ham with Shallots and Carrots ,951.0
Meyer Lemon Budino ,161.0
Agave Margarita ,
Mexican Sandwiches ,789.0
"Grilled Chicken with Goat Cheese Stuffing, Peppers, Onions and Two Salsas ",681.0
"Celery Root, Radish, and Watercress Salad with Mustard Seed Dressing ",229.0
Blood Orange Roast Pork Loin ,
Rice with Soy-Glazed Bonito Flakes and Sesame Seeds ,386.0
Pickled Napa Cabbage ,34.0
Quick-Pickled Carrots ,120.0
Tagliatelle with Zucchini and Shrimp ,2061.0
Celery Seed Dressing ,184.0
"Salmon Salad with Fennel, Orange, and Mint ",
Lemon Pasta with Chicken and Pine Nuts ,1069.0
Cornmeal Biscuits with Chorizo Gravy and Scallions ,1209.0
"Roasted Sausages, Apples, and Cabbage with Caraway ",357.0
Apple Galette ,
Poulet aux Citrons Confits et Olives ,1196.0
Pistachio Meringues ,69.0
Pasta with Fresh Tomato-Herb Sauce ,
"Sauteed Chicken with Parsnip, Apple, and Sherry Pan Sauce ",475.0
Linguine with Pears and Gorgonzola Cheese ,842.0
Fresh Blackberry Napoleons with Cream Cheese Mousse ,473.0
Thyme-Toasted Almonds ,
Grilled Tea-Brined Turkey with Tea-and-Lemon Gravy ,1600.0
Fried Mozzarella Skewers ,895.0
Red Pepper Sauce ,38.0
Sauteed Mushrooms with Lemon Cream ,170.0
Strawberry-Cucumber Salad with Lemon Cream ,159.0
Garlic and Sage Marinated Antipasto ,395.0
Pineapple and Banana Couscous Pudding ,283.0
Cardamom Chai ,47.0
Banana Gratins ,
Blender Mayonnaise ,249.0
Turkish Grilled Turkey or Chicken with Tangy Herbed Yogurt ,381.0
Cornish Game Hen with Stuffing and Sherried Gravy ,
Merveilles ,22.0
Berry Napoleons ,552.0
Grilled Korean-Style Short Ribs ,619.0
Parmesan Bread Pudding with Broccoli Rabe and Pancetta ,
Frittata with Mustard Greens and Fontina ,379.0
"Potato, Caramelized Onion, and Goat Cheese Gratin ",499.0
Whole-Wheat Scones ,315.0
Chicken Giblet Stock ,1.0
Citrus-Brined Pork Loin with Peach Mustard ,683.0
Vodka and Watermelon Cooler ,80.0
Berry-Vodka Cooler ,257.0
Salmon Burgers with Spinach and Ginger ,
Crazy Cantina Chili ,742.0
Classic Mayonnaise ,82.0
Crispy Fried Shallots ,202.0
Blue Plate Special Meat Loaf ,
Coconut Rum Cake ,798.0
Twice-Baked Almond Cookies ,61.0
Grilled Chicken with Roasted Tomato and Oregano Salsa ,
Apple Chips ,195.0
Nachos ,727.0
Feta and Mint Rice ,575.0
Sticky Spicy Ribs ,1318.0
Vegetable Ragoût ,
Frozen Raspberry Zabaglione on Meringues with Chocolate Sauce ,480.0
Creamy Grits with Rosemary Bacon ,497.0
Beef Pasties with Caramelized Onions and Stilton Cheese ,1052.0
Candied Walnuts ,211.0
Rib-Eye Steaks with Bell Peppers and Gorgonzola Butter ,617.0
Deviled Potato Salad ,415.0
Fresh Homemade Ricotta ,202.0
Three-Berry Pie with Vanilla Cream ,191.0
Spinach Salad with Tamarind Dressing and Pappadam Croutons ,183.0
Wee Gazpacho ,84.0
Roasted Tomato and Herb Tart ,904.0
Apple-Cranberry Crisp ,304.0
Sesame Carrots ,28.0
Avocado Salsa ,245.0
Bacon-Wrapped Trout ,1085.0
Grilled Chicken Breast Stuffed with Prosciutto and Basil ,463.0
Piña Colada Pie ,544.0
Cream Cheese Crostata with Orange Marmalade ,752.0
"Banana, Raspberry, and Granola Yogurt ",428.0
Cajeta Flan ,276.0
Tossed Fresh Fruit Salad with Orange Mayonnaise Dressing ,476.0
"Grilled Scallop ""Ceviche"" ",160.0
Five-Spice Roasted Guinea Hens ,1061.0
Overnight Pizza Dough ,
Melon and Berry Compote ,60.0
Cabbage and Corn Slaw with Cilantro and Orange Dressing ,233.0
Turkey Mole ,1166.0
Tortellini with Chicken and Pesto ,
Thai Tea Pudding with Lime Caramel and Candied Cashews ,407.0
Pork Tenderloin Cubano ,243.0
Farmhouse Herbed Stuffing ,239.0
"Spaghetti with Cauliflower, Green Olives, and Almonds ",802.0
Macadamia Nut and Bittersweet Chocolate Ice-Cream Bombe with Macadamia Nut Praline ,1231.0
Baked Minty Rice with Feta and Pomegranate Relish ,623.0
Brisket With Pomegranate-Walnut Sauce and Pistachio Gremolata ,1277.0
Apple Fennel Granita ,
Fish and Chips with Malt Vinegar Mayonnaise ,
Chocolate Chestnut Torte with Chocolate Cognac Mousse ,1508.0
Pasta with Chickpeas and Charred Tomatoes ,
Grilled Halloumi With Watermelon and Basil-Mint Oil ,
Poached Chicken Breast Stuffed with Goat Cheese and Spinach ,
Garlic Rosemary Jelly ,
Broccoli and Cheddar Skillet Flan ,427.0
Smoked Turkey and Blue Cheese Salad ,
Tuna and Vegetable Fettuccine with Lemon Breadcrumbs ,779.0
Basil-Arugula Pesto ,679.0
Penne with Basil-Seafood Sauce ,509.0
"Red, White, and Blue Ice Cream Cake ",654.0
Tomato-Chipotle Soup with Fresh Peach Salsa ,
Madeira Cream Gravy ,2899.0
Swiss Chard Gratin ,331.0
Pork Spice Rub ,62.0
Lemon Garlic Mayonnaise ,
Traditional Fish Stock ,16.0
Apple and Dried-Cherry Lattice Pie ,697.0
Cantaloupe Sherbet ,234.0
Radish and Cucumber Salad with Yogurt Dressing ,47.0
"Veal and Tomato Ragoût with Potatoes, Cinnamon, and Cream ",570.0
Apple Pancakes with Cinnamon Butter ,146.0
Cherry Tomato Pizza Margherita ,
Pearl Couscous with Olives and Roasted Tomatoes ,442.0
Pineapple Sangria ,204.0
Chick-Pea Tomato Stew with Moroccan Flavors ,402.0
"Potato, Celery and Ham Salad with Tarragon ",188.0
Spicy Kale and Chick-Pea Stew ,213.0
Butternut Squash Gnocchi with Duck Confit and Swiss Chard ,942.0
Spiced Persimmon Chutney ,288.0
Summer Crudités with Bagna Cauda ,587.0
Coffee Ice Cream Sundaes with Pine Nut-Caramel Sauce ,
Orecchiette with Sausage and Red Pepper Sauce ,647.0
Veal Chops with Sherry Gastrique and Roasted Peperonata ,154.0
Avocado Mayonnaise ,379.0
Vacherins with Raspberry Sorbet and Mixed Berry-Cardamom Sauce ,536.0
Lentil and Rice Salad ,314.0
Smoked Salmon Chowder ,317.0
Tandoori-Spiced Chicken Breasts ,
"Blue Cheese, Port, and Walnut Spread ",276.0
Paella Valenciana ,1283.0
Steak with Chimichurri Sauce ,991.0
Lemon Macaroon Ice Cream with Blueberry Compote ,
Fruitcake with Ginger Cream Cheese ,109.0
Beef Shank and Sausage Ragù with Whole Grain Spaghetti ,791.0
Fruity Iced Tea ,70.0
Cucumber Avocado Soup ,114.0
Linguine with Baby Heirloom Tomatoes and Anchovy Breadcrumbs ,
Kabocha Squash and Pork Stir-Fry ,258.0
Summer Chicken Sauté with Tomato-Basil Sauce ,
Lemon-Buttermilk Ice Pops ,96.0
"Wild Rice, Apple, and Dried-Cranberry Stuffing ",375.0
Pommes Anna ,184.0
Pasta Paella with Clams and Spicy Sausage ,715.0
Grilled Rosemary Chicken ,
Green Bean and Red Onion Salad with Warm Cider Vinaigrette ,218.0
Collard Greens Slaw ,76.0
"Asparagus Salad with Celery Leaves, Quail Eggs, and Tarragon Vinaigrette ",
Cream of Cope's Corn Soup with Shrimp and Wild Mushrooms ,320.0
Sour Cream Raisin Pie ,
Steaks with Herb-Spice Blend ,3367.0
Spice-Rubbed Lamb Chops with Roasted Tomatoes ,1391.0
Duck with Walnut Sherry Vinaigrette ,483.0
Asparagus Ravioli in Parmesan Sauce ,
Juana's Chicken-Stuffed Poblanos ,
"Celery, Radish, and Olive Salad ",192.0
Pastry Dough ,234.0
Cornmeal-Crusted Chicken Salad ,
Barley and Roasted-Vegetable Soup ,
Candied Kumquats ,234.0
Fresh Vegetable Broth ,
Spicy Roasted Red Pepper and Cheese Corn Breads ,279.0
Roasted Salmon with Cranberry-Mustard Sauce ,485.0
Curried Beef Stew ,465.0
Melange of Winter Vegetables ,195.0
Baked Oysters in Jackets with Bacon Cognac Butter ,115.0
Ultra-Buttery Irish Scones ,
Elvis-Inspired Peanut Butter Banana Waffles ,
Rotelle with Mushroom Sauce ,557.0
Butternut Squash and Rutabaga Purée ,198.0
3-Ingredient Red Snapper With Green Sauce and Scallions ,
Fennel-Crusted Roast Pork ,
Buffalo Grilled Shrimp with Blue Cheese Dip and Celery ,1881.0
Spicy Roasted Vegetable Soup with Toasted Tortillas ,505.0
Tennessee Williams's Lemon Icebox Pie ,3420.0
Alexander Young ,127.0
Caramelized-Onion Dip with Cilantro-Garlic Pita Crisps ,223.0
Honey-Hazelnut Financiers ,276.0
Shrimp and Spinach with Tomato Curry Over Naan ,
Glögg ,370.0
Four-Cheese Manicotti ,716.0
"Steamed Clams and Lobster with Shallot Butter, Corn, Sausages and Potatoes ",
Old-Fashioned Meat Loaf ,725.0
Honey-Peach Tart with Vanilla Ice Cream ,326.0
"Do-Ahead Sheboygan ""Brats"" ",420.0
Fresh Pumpkin Purée ,169.0
Pork Chops with Sour Cream-Dill Sauce ,877.0
Feta Walnut Date Cigars ,120.0
Warm Wild Mushroom Salad ,183.0
Ham with Tart Berry Sauce ,353.0
Tongue with Mustard-Horseradish Sauce ,609.0
Miso-Turmeric Dressing ,357.0
Spiced Salad Dressing ,336.0
South American Fried Chicken ,417.0
Brown Rice Pilaf with Saffron and Ginger ,
Spicy Black Bean Cakes ,127.0
Roast Chicken with Lemon and Tarragon Butter ,1078.0
Chicken and White Bean Soup with Herb Swirl ,750.0
Roast Turkey with Port Wine Gravy ,2043.0
Smoky Tomato Sauce ,
"Sliced Filet Mignon with Fava Beans, Radishes, and Mustard Dressing ",810.0
Caramelized Apples ,405.0
Applejack Rabbit ,96.0
"Grilled Eggplant, Sandwiches with Lemon Aïoli, Feta, and Mint ",505.0
Grilled Lamb with Lima Bean Skordalia ,1114.0
Carrot and Bell Pepper Slaw ,155.0
Sliced Baked Apples ,253.0
"Pea, Radish, and Cabbage Slaw ",176.0
Salted Roast Turkey with Chipotle Glaze and Caramelized-Onion Gravy ,1177.0
Lemon Ice Cream Sandwiches with Blueberry Swirl ,465.0
White Chocolate Mousse and Berry Tart ,588.0
Spiced Cranberry Sauce ,172.0
Whole Wheat-Apple Crisp ,258.0
Honey-Brandy Oranges ,174.0
Rosemary-Concord Shrub ,
Green Bean and Radicchio Salad with Roasted Beets and Balsamic Red Onions ,128.0
Smoked Chicken Chowder ,298.0
Roast Turkey with Sage Butter ,
Mojo Marinade ,96.0
Spicy Lamb and Chorizo Chili ,1252.0
Chocolate Hazelnut Torte ,275.0
Scallop Tea Rice ,451.0
Lemon Thyme Madeleines with Lemon Vodka Syrup ,118.0
Buckwheat Crepes with Pears and Crème Fraîche ,
Blueberry-Buttermilk Bundt Cake ,367.0
Classic Red Rice ,353.0
Sweet-Potato Fritters ,366.0
"Shrimp with Fennel, Dill, and Feta ",229.0
Pickled Red Onions ,
Cheesy Shrimp Enchilada Bake ,
Rutabaga and Carrot Purée ,119.0
Crab Stock ,
Hazelnut-Cinnamon Biscotti ,117.0
Lemon Souffles with Boysenberries ,
Cold Beet and Celery Soup ,
Cilantro Mint Chutney ,53.0
Mahi-Mahi with Fresh Cilantro Chutney ,
Ginger Syrup ,217.0
Toasted Sweet Corn Pudding ,215.0
"Chicken, Potato, and Carrot Enchiladas with Ancho-Guajillo Chile Sauce ",815.0
Chicken with Honey-Mustard Sauce ,807.0
Lemon Chicken Cutlets ,268.0
Smothered Grilled Pork Chops ,759.0
Cheddar Cheese Biscuits with Dill and Chives ,177.0
Roast Rack of Lamb with Hoisin-Orange Glaze and Red Onions ,1296.0
Paprika Rice ,213.0
Rib-Eye Steaks with Roasted Red Peppers and Balsamic Vinegar ,1320.0
Roast Loin of Pork with Apple-Onion Chutney ,325.0
"Zucchini, Cheese and Herb Fritters ",295.0
"Peanut Butter, Scallion, and Bacon Canapes ",68.0
Egg Ribbon and Parmesan Soup ,267.0
Creamy Pappardelle with Leeks and Bacon ,613.0
Sizzling Halloumi Cheese with Fava Beans and Mint ,493.0
Scallop Brochettes with Mango-Tarragon Salsa ,281.0
Waikaloa Breeze ,264.0
Leek Tart ,262.0
Fideos with Mussels ,414.0
Gingered Apple Slaw ,299.0
"Pizza with Sausage, Tomatoes and Basil ",
Brined Roast Turkey Breast with Confit Legs ,
Bacon Smashed Potatoes ,254.0
Arugula and Green Bean Salad with Walnut Oil Dressing ,157.0
White Chocolate Truffle and Chocolate Fudge Layer Cake ,1174.0
Cooked Raspberry Sauce ,
Spicy Ham Hash ,577.0
Potato Latkes ,311.0
Grilled Sardine Tartines with Onion and Arugula ,555.0
"Pasta with Chicken, Sun-Dried Tomatoes, Gorgonzola and Pine Nuts ",749.0
Raspberry-Apricot Compote with Champagne and Lemon Verbena ,53.0
Grilled Spicy-Citrus Chicken Thighs with Corn and Green Onions ,1411.0
Three-Mustard Mayonnaise ,165.0
Sweet-Potato Gaufrettes with Duck Confit and Cranberry Black Pepper Chutney ,563.0
"Herbed Bread, Cracker and Leek Dressing ",304.0
Peppered Tuna with Mango-Corn Salsa ,
Green Beans with Mushroom-Madeira Sauce ,433.0
Flounder in Jalapeño Cream ,
Lemon Tart with Frozen Lime Cream ,279.0
Rum Currant Ice Cream ,218.0
Sauteed Salmon with Dill Lemon Pesto ,257.0
"Butternut Squash, Bacon, and Rosemary Phyllo Pizza ",455.0
Chicory-Apple Salad with Brown Butter Dressing ,
Lamb and Sweet Potato Stew ,853.0
Whole Wheat Porcini Soda Bread ,286.0
Vegetable Kebabs with Mustard Basting Sauce ,
Sugar Snap Peas with Toasted Sesame Seeds ,41.0
Yellow Tomato Gazpacho with Cilantro Oil and Avocado ,156.0
Nectarine-Pecan Cookie Tarts ,350.0
Peach Lattice Pie ,489.0
Avgolemono ,185.0
Lazy Texas Brisket ,526.0
Chicken Potpie with Chive Mash Potatoes ,
Cherry-Fudge Brownies with Chocolate Sauce and Chocolate-Dipped Cherries ,658.0
Soy Vinegar Dipping Sauce ,101.0
Du Barry ,142.0
